<?xml version="1.0" encoding="UTF-8"?>
<!DOCTYPE studentEnrollments PUBLIC "-//UniTime//DTD University Course Timetabling/EN" "http://www.unitime.org/interface/StudentEnrollment.dtd">

<!-- 
 * Licensed to The Apereo Foundation under one or more contributor license
 * agreements. See the NOTICE file distributed with this work for
 * additional information regarding copyright ownership.
 *
 * The Apereo Foundation licenses this file to you under the Apache License,
 * Version 2.0 (the "License"); you may not use this file except in
 * compliance with the License. You may obtain a copy of the License at:
 *
 * http://www.apache.org/licenses/LICENSE-2.0
 *
 * Unless required by applicable law or agreed to in writing, software
 * distributed under the License is distributed on an "AS IS" BASIS,
 * WITHOUT WARRANTIES OR CONDITIONS OF ANY KIND, either express or implied.
 *
 * See the License for the specific language governing permissions and
 * limitations under the License.
 * 
 -->
<studentEnrollments campus="woebegon" year="2010" term="Fal">
  <!-- when a student with the given external id does not exist, it is created -->
  <!-- for such a case, it is helpful if student name and email is provided (these are only used when a new student is created) -->
  <student externalId="1000" firstName="Jacob" middleName="Lucas" lastName="Simth" email="smith@university.edu">
    <class externalId="123124"/>
    <class externalId="123412"/>
    <!-- course (external) id is optional, and only useful for cross-listed courses to import enrollments to a non-controlling course -->
    <!-- since UniTime 3.3.24 -->
    <class externalId="129854" courseId="12432"/>
  </student>
  
  <!-- otherwise, providing just an external id for a student is enough -->
  <student externalId="1001">
    <!-- if there is no external id on the class, class name can be used instead -->
    <!-- only in UniTime 3.1.283 or later -->
    <class externalId="PSY 101 Lec 1"/>
    <!-- if external ids are not available, subject, courseNbr, type and suffix can be used instead -->
    <!-- since UniTime 3.3.24 -->
    <class subject="PSY" courseNbr="101" type="Lec" suffix="1"/>
    <class subject="ECON" courseNbr="101" type="Lec" suffix="1"/>
    <class subject="SOC" courseNbr="101" type="Lec" suffix="2"/>
    <class subject="ALG" courseNbr="101" type="Lec" suffix="1"/>
    <class subject="COM" courseNbr="101" type="Lec" suffix="1"/>
  </student>
  
  <student externalId="1002">
    <class subject="GER" courseNbr="101" type="Lec" suffix="2"/>
    <class subject="GER" courseNbr="101" type="Lab" suffix="3"/>
    <class subject="ECON" courseNbr="101" type="Lec" suffix="1"/>
    <class subject="PSY" courseNbr="101" type="Lec" suffix="1"/>
    <class subject="COM" courseNbr="101" type="Lec" suffix="2"/>
    <class subject="ALG" courseNbr="101" type="Lec" suffix="1"/>
  </student>
  <student externalId="1003">
    <class subject="ENGL" courseNbr="101" type="Lec" suffix="1"/>
    <class subject="CALC" courseNbr="101" type="Lec" suffix="1"/>
    <class subject="CALC" courseNbr="101" type="Rec" suffix="1"/>
    <class subject="C S" courseNbr="101" type="Lab" suffix="1"/>
    <class subject="C S" courseNbr="101" type="Lec" suffix="2"/>
    <class subject="ECON" courseNbr="101" type="Lec" suffix="1"/>
    <class subject="PSY" courseNbr="101" type="Lec" suffix="1"/>
    <class subject="ENGL" courseNbr="101" type="Lab" suffix="1"/>
  </student>
  <student externalId="1004">
    <class subject="PHAR" courseNbr="101" type="Lec" suffix="1"/>
    <class subject="ENGL" courseNbr="101" type="Lab" suffix="6"/>
    <class subject="CALC" courseNbr="101" type="Lec" suffix="1"/>
    <class subject="CALC" courseNbr="101" type="Rec" suffix="2"/>
    <class subject="CHM" courseNbr="101" type="Lab" suffix="7"/>
    <class subject="CHM" courseNbr="101" type="Rec" suffix="7"/>
    <class subject="BIOL" courseNbr="101" type="Lec" suffix="2"/>
    <class subject="CHM" courseNbr="101" type="Lec" suffix="2"/>
    <class subject="BIOL" courseNbr="101" type="Pso" suffix="2"/>
    <class subject="BIOL" courseNbr="101" type="Rec" suffix="6"/>
    <class subject="BIOL" courseNbr="101" type="Lab" suffix="5"/>
    <class subject="ENGL" courseNbr="101" type="Lec" suffix="6"/>
  </student>
  <student externalId="1005">
    <class subject="CALC" courseNbr="101" type="Lec" suffix="2"/>
    <class subject="CHM" courseNbr="101" type="Rec" suffix="3"/>
    <class subject="CALC" courseNbr="101" type="Rec" suffix="5"/>
    <class subject="CHM" courseNbr="101" type="Lec" suffix="1"/>
    <class subject="PHAR" courseNbr="101" type="Lec" suffix="1"/>
    <class subject="BIOL" courseNbr="101" type="Rec" suffix="4"/>
    <class subject="ENGL" courseNbr="101" type="Lec" suffix="5"/>
    <class subject="CHM" courseNbr="101" type="Lab" suffix="3"/>
    <class subject="ENGL" courseNbr="101" type="Lab" suffix="5"/>
    <class subject="BIOL" courseNbr="101" type="Pso" suffix="1"/>
    <class subject="BIOL" courseNbr="101" type="Lec" suffix="1"/>
    <class subject="BIOL" courseNbr="101" type="Lab" suffix="4"/>
  </student>
  <student externalId="1006">
    <class subject="BIOL" courseNbr="101" type="Lec" suffix="1"/>
    <class subject="CHM" courseNbr="101" type="Lec" suffix="2"/>
    <class subject="CHM" courseNbr="101" type="Rec" suffix="6"/>
    <class subject="CHM" courseNbr="101" type="Lab" suffix="6"/>
    <class subject="CALC" courseNbr="101" type="Lec" suffix="2"/>
    <class subject="CALC" courseNbr="101" type="Rec" suffix="8"/>
    <class subject="PHAR" courseNbr="101" type="Lec" suffix="1"/>
    <class subject="ENGL" courseNbr="101" type="Lec" suffix="2"/>
    <class subject="ENGL" courseNbr="101" type="Lab" suffix="2"/>
    <class subject="BIOL" courseNbr="101" type="Rec" suffix="1"/>
    <class subject="BIOL" courseNbr="101" type="Pso" suffix="1"/>
    <class subject="BIOL" courseNbr="101" type="Lab" suffix="1"/>
  </student>
  <student externalId="1007">
    <class subject="CALC" courseNbr="101" type="Rec" suffix="6"/>
    <class subject="ENGR" courseNbr="101" type="Lec" suffix="1"/>
    <class subject="COM" courseNbr="101" type="Lec" suffix="6"/>
    <class subject="CALC" courseNbr="101" type="Lec" suffix="2"/>
    <class subject="BAND" courseNbr="101" type="Lec" suffix="1"/>
    <class subject="CHM" courseNbr="101" type="Rec" suffix="11"/>
    <class subject="CHM" courseNbr="101" type="Lec" suffix="3"/>
    <class subject="CHM" courseNbr="101" type="Lab" suffix="11"/>
    <class subject="PHYS" courseNbr="101" type="Lec" suffix="2"/>
    <class subject="PHYS" courseNbr="101" type="Lab" suffix="4"/>
    <class subject="ENGR" courseNbr="101" type="Lab" suffix="3"/>
    <class subject="PHYS" courseNbr="101" type="Rec" suffix="4"/>
  </student>
  <student externalId="1008">
    <class subject="COM" courseNbr="101" type="Lec" suffix="5"/>
    <class subject="CHM" courseNbr="101" type="Lab" suffix="2"/>
    <class subject="CHM" courseNbr="101" type="Lec" suffix="1"/>
    <class subject="CHM" courseNbr="101" type="Rec" suffix="2"/>
    <class subject="BIOL" courseNbr="101" type="Lec" suffix="2"/>
    <class subject="BIOL" courseNbr="101" type="Lab" suffix="2"/>
    <class subject="BIOL" courseNbr="101" type="Rec" suffix="2"/>
    <class subject="BIOL" courseNbr="101" type="Pso" suffix="1"/>
    <class subject="CALC" courseNbr="101" type="Lec" suffix="3"/>
    <class subject="CALC" courseNbr="101" type="Rec" suffix="9"/>
    <class subject="ENGR" courseNbr="101" type="Lec" suffix="1"/>
    <class subject="ENGR" courseNbr="101" type="Lab" suffix="1"/>
  </student>
  <student externalId="1009">
    <class subject="CHM" courseNbr="101" type="Rec" suffix="12"/>
    <class subject="CHM" courseNbr="101" type="Lec" suffix="3"/>
    <class subject="CHM" courseNbr="101" type="Lab" suffix="12"/>
    <class subject="PHYS" courseNbr="101" type="Lec" suffix="2"/>
    <class subject="ENGR" courseNbr="101" type="Lab" suffix="2"/>
    <class subject="PHYS" courseNbr="101" type="Lab" suffix="3"/>
    <class subject="PHYS" courseNbr="101" type="Rec" suffix="3"/>
    <class subject="ENGL" courseNbr="101" type="Lab" suffix="4"/>
    <class subject="CALC" courseNbr="101" type="Lec" suffix="1"/>
    <class subject="CALC" courseNbr="101" type="Rec" suffix="3"/>
    <class subject="ENGR" courseNbr="101" type="Lec" suffix="1"/>
    <class subject="ENGL" courseNbr="101" type="Lec" suffix="4"/>
  </student>
  <student externalId="1010">
    <class subject="C S" courseNbr="101" type="Lab" suffix="2"/>
    <class subject="PHYS" courseNbr="101" type="Rec" suffix="5"/>
    <class subject="PHYS" courseNbr="101" type="Lec" suffix="2"/>
    <class subject="PHYS" courseNbr="101" type="Lab" suffix="5"/>
    <class subject="ENGL" courseNbr="101" type="Lec" suffix="3"/>
    <class subject="CALC" courseNbr="101" type="Lec" suffix="1"/>
    <class subject="CALC" courseNbr="101" type="Rec" suffix="4"/>
    <class subject="C S" courseNbr="101" type="Lec" suffix="1"/>
    <class subject="ENGL" courseNbr="101" type="Lab" suffix="3"/>
    <class subject="CHM" courseNbr="101" type="Rec" suffix="4"/>
    <class subject="CHM" courseNbr="101" type="Lec" suffix="1"/>
    <class subject="CHM" courseNbr="101" type="Lab" suffix="4"/>
  </student>
  <student externalId="1011">
    <class subject="SPAN" courseNbr="101" type="Lab" suffix="4"/>
    <class subject="SPAN" courseNbr="101" type="Lec" suffix="2"/>
    <class subject="BIOL" courseNbr="101" type="Lec" suffix="1"/>
    <class subject="COM" courseNbr="101" type="Lec" suffix="7"/>
    <class subject="POL" courseNbr="101" type="Lec" suffix="2"/>
    <class subject="PSY" courseNbr="101" type="Lec" suffix="1"/>
    <class subject="BIOL" courseNbr="101" type="Rec" suffix="3"/>
    <class subject="BIOL" courseNbr="101" type="Lab" suffix="3"/>
    <class subject="BIOL" courseNbr="101" type="Pso" suffix="1"/>
  </student>
  <student externalId="1012">